{"schema":"b3_parallel_admission_v3","contract_grants_execution":false,"content_adopted":false,"run_ready":false,"science_release":null,"scientific_adoption":null,"retry":0,"resume":false,"mandatory_STOP":true,"r1_reference":{"schema":"b3_formal_admission_v2","content_adopted":true,"contract_grants_execution":false,"retry":0,"resume":false,"mandatory_STOP":true,"release":{"commit":"1111111111111111111111111111111111111111","f01_status":"F01_INTEGRATED_REGRESSION_PASS","failure_provenance_regression_sha256":"2222222222222222222222222222222222222222222222222222222222222222"},"adoption":{"adopted_package":"R1","instruction_sha256":"3333333333333333333333333333333333333333333333333333333333333333","record_path":"adoption.json","record_sha256":"be0856cf0289338fbba098bf60d3ade27e9a6a6b36285cc7e16e49422dadeb35"},"candidate":{"schema":"g6_w2c_b3_driver_candidate_v1","status":"ARTIFICIAL_ONLY","adopted":true,"contract_grants_execution":false,"separate_execution_approval":false,"base_commit":"c8cbeb18f76aef2cb1329d8c810036372fa07cc0","output_relative":"artificial-output","input":{"id":"P5_general_order","p":["1/5","3/10","1/2"],"x":"5/7","m":5},"policy":{"root_bits":256,"probability_bits":160,"eta":"1/1000000000000","rho":"1/1000000000000","epsilon_axis":"1/200","primitive_error":"1/1000000","alpha_axis":"1/320","alpha_familywise_16_axes":"1/20","sigma":1},"source_pins":{"src/trottertracks/algorithm_codesign/g7_generator.py":"bb4177d26f1cee9721c2b083de01f4aa309f3ad39f22597cfae3b662881269fb","src/trottertracks/algorithm_codesign/return_aggregation.py":"f716d3c69fc1063e47b7618022662715f6b34a9c1f35cc3e7ed26813f5ac69f0","src/trottertracks/algorithm_codesign/g7_provider.py":"17fff6d4d9fa9c9728091f6f01a4e6af1a389e8949c6e4a2ec6e3112f2fe3c62","src/trottertracks/algorithm_codesign/g6_f3_contract.py":"754c27f72f3356b3072ced4a00bef174b8922d2efedd0eff18d86a887fa598e1","src/trottertracks/algorithm_codesign/g6_f3_precision.py":"c2136326042fcf95240ecae41436cd953a1f857543ec9797e57f8fcbbe158706","src/trottertracks/algorithm_codesign/g6_f3_generator.py":"2ccce19571cdf33527abc92f049f35ef4e0d33d8a876132b2d1d70f6e63ad751","src/trottertracks/algorithm_codesign/g6_w2c_cost_preparation.py":"35a4a0d8b28fd1a50791cc2afd09ac86800a1f37b488dc4cee5906864ea7f0e1","src/trottertracks/algorithm_codesign/g6_w2c_b3_driver.py":"5e6904e782526e96cc6a2dc9e94642a8237b4aa69ce8743aec24ccde5f212694","src/trottertracks/algorithm_codesign/__init__.py":"b6503716cfd51d52ca9038e6de5a411eb78380d30451f81df9b81c31b1be090f","src/trottertracks/__init__.py":"2d51bfa08b2b1e000b86ec53bd463e786529307a7270078600e3b03995e90285","src/trottertracks/algorithm_codesign/g6_w2c_b3_readiness.py":"f6cbb170b99bd67926c66eeb982df67a1dd4506dcc8fc40f5016cf482341b00a","src/trottertracks/algorithm_codesign/g6_w2c_b3_admission.py":"b718047a96353f60bfda4ee08694e610be7e53c701185d1ceda539146f1ae750","src/trottertracks/algorithm_codesign/g6_w2c_b3_host.py":"49e753184b66b22b41287acade1c9ac6a43249321481c6fe53149b43c2bd03b9"},"original_source_commits":{"G7":"ab2549f41b3546fb3940342a2162dd9ee93699c4","ReturnKernel":"28cfabb1d47e0e1824bce1e154a9c289738fa2b9","F3":"1aea9b8c228c5b940f2fcba0f94493b3ffdec46e","W2b":"ed26d1c85cf7ad80625f7abbc662b70abd690a97","W2c-A":"864097c1285f1f06399040cf0f7c0f42334d9252"},"saved_evidence":{"commit":"a689694080f4b7600fe67cf77d841d1cbbf04503","path":"artifacts/track_b_g7_budget_control_result/2026-10-10/v1/result_v1.json","bytes":199838,"sha256":"1bc884aec33d284dfd363dd721d43af68794b659eaa8ef61d18d28c166306f64"},"saved_rows":{"ordinary":"/rows/4","partial_return_tail":"/rows/5","closed_P3_tail":"/rows/6","full_return":"/rows/7"},"cells":[{"arm":"ordinary","layer":"A","axis":"X","N":1174526},{"arm":"ordinary","layer":"A","axis":"Y","N":1174526},{"arm":"ordinary","layer":"B","axis":"X","N":1174526},{"arm":"ordinary","layer":"B","axis":"Y","N":1174526},{"arm":"partial_return_tail","layer":"A","axis":"X","N":894664},{"arm":"partial_return_tail","layer":"A","axis":"Y","N":894664},{"arm":"partial_return_tail","layer":"B","axis":"X","N":894664},{"arm":"partial_return_tail","layer":"B","axis":"Y","N":894664},{"arm":"closed_P3_tail","layer":"A","axis":"X","N":880312},{"arm":"closed_P3_tail","layer":"A","axis":"Y","N":880312},{"arm":"closed_P3_tail","layer":"B","axis":"X","N":880312},{"arm":"closed_P3_tail","layer":"B","axis":"Y","N":880312},{"arm":"full_return","layer":"A","axis":"X","N":1014322},{"arm":"full_return","layer":"A","axis":"Y","N":1014322},{"arm":"full_return","layer":"B","axis":"X","N":1014322},{"arm":"full_return","layer":"B","axis":"Y","N":1014322}],"passes":["baseline","instrumented"],"correctness_trials_per_cell":16,"call_budget":{"correctness_sampling_calls":256,"baseline_full_N_sampling_calls":15855296,"instrumented_full_N_sampling_calls":15855296,"total_sampling_calls":31710848,"constructor_calls":24,"budget_recomputation_calls":0,"saved_budget_file_loads":1,"Full_F3_prepare_including_constructor_calls":3,"canonical_preflight_calls":9,"new_circuit_or_compile_or_synthesis_calls":0,"B1_B2_reenumeration_or_recalculation_calls":0,"angle_calls":"B only: one per accepted trial; canonical B = 4*N_a+32 each arm, Full B = observed accepted <=4*N_F+32","event_requeries":"one per B accepted trial; Full invokes original F3 event->packet; canonical original event(group,raw,child)","packet_calls":"Full original sample: one iff raw-valid, including coin reject; plus B angle requery iff accepted; frozen setup unchanged","source_checks":"shared file load/hash; per-pair setup; four sharing checks per pair; B overlay every operation; original F3 guards retained","bound_semantics":"exact scheduled sample count on success; variable path-dependent work counted, never force extra trials for coverage"},"decisions":{"angle":{"tau":"1/1000000","K_phi":32,"J":32,"mode":"MATHEMATICAL_ENCLOSURE_ONLY_NO_PHYSICAL_CHANGE"},"seed":{"algorithm":"FROZEN_G7_SHA256_COUNTER","namespace":"B3_FULL_N_NEW_20261019_V1","domain":"namespace/arm/axis","reuse":"same prefix across A/B, correctness, baseline and instrumented; X/Y distinct","IID_claim":false,"old_128_trial_evidence":"citation only; no reuse of old consumed claim or diagnostic seed"},"schedule_and_output":{"result_bytes":68719476736,"log_bytes":268435456,"flush_rows":4096,"retention":"all-trial compact exact-document hashes; full documents first 16/axis and failure context","constructor":"one per arm/layer/phase-pass; share X/Y after initial/X/Y/final state/source identity checks","cache":"no new law/packet/angle memo; frozen held state X/Y only; fresh process per pair; OS cache uncontrolled","order":"correctness then baseline then instrumented; fixed arm order, A then B; own fresh Linux fork child per pair","angle":"A ratio only; B every accepted event, no cache, Full original F3 requery and canonical audited requery","memory":"own child /proc/self RSS samples every 4096 trials and own HWM/final RSS; not continuous RSS peak","output":"unbuffered per-pair exclusive JSONL; exact hex rational payload, chain SHA and file SHA; no append","flush":"Python unbuffered flush, not fsync or power-failure durability","overhead":"coarse and fine exclusive partitions separately reconciled to outer child total; baseline replay separate","resource_caps":{"CPU":null,"RAM":null,"workers":null,"wall_time":null}},"source_release":"1111111111111111111111111111111111111111","external_admission":"DURABLE_ATOMIC_R1_V1"},"angle_proposal":{"mode":"MATHEMATICAL_ENCLOSURE_ONLY_NO_PHYSICAL_CHANGE","tau":null,"K_phi":null,"J":null,"extra_error_allocation":null,"physical_RZ_changed":false,"angle_refinement_or_search":false},"seed_proposal":{"algorithm":"FROZEN_G7_SHA256_COUNTER","namespace":"B3_FULL_N_NEW_20261019_V1","domain":"namespace/arm/axis","reuse":"same prefix across A/B, correctness, baseline and instrumented; X/Y distinct","IID_claim":false,"old_128_trial_evidence":"citation only; no reuse of old consumed claim or diagnostic seed"},"schedule_proposal":{"result_bytes":68719476736,"log_bytes":268435456,"flush_rows":4096,"retention":"all-trial compact exact-document hashes; full documents first 16/axis and failure context","constructor":"one per arm/layer/phase-pass; share X/Y after initial/X/Y/final state/source identity checks","cache":"no new law/packet/angle memo; frozen held state X/Y only; fresh process per pair; OS cache uncontrolled","order":"correctness then baseline then instrumented; fixed arm order, A then B; own fresh Linux fork child per pair","angle":"A ratio only; B every accepted event, no cache, Full original F3 requery and canonical audited requery","memory":"own child /proc/self RSS samples every 4096 trials and own HWM/final RSS; not continuous RSS peak","output":"unbuffered per-pair exclusive JSONL; exact hex rational payload, chain SHA and file SHA; no append","flush":"Python unbuffered flush, not fsync or power-failure durability","overhead":"coarse and fine exclusive partitions separately reconciled to outer child total; baseline replay separate","resource_caps":{"CPU":null,"RAM":null,"workers":null,"wall_time":null}},"acceptance":{"initial_correctness":"all 16 trials/cell complete; at least one accepted per cell; exact event invariants; B preflight and all requested angle checks; A/B trace identity; no extra sampling on missing path","full_workload":"exact N per cell per pass, R+C+A=N; no technical failure; A/B and baseline/instrumented exact event trace equality; correctness prefix equality; source/state guards; output chain/file SHA","cost":"coarse exclusive sum<=own outer total, fine exclusive sum<=own outer total separately; residual explicit; compare whole paired baseline/instrumented observations without equality/CI assumption"},"one_shot":{"bundles":1,"automatic_retry":0,"resume":false,"starts_at":"first authorized correctness construction/call after external atomic admission","old_claim_reuse":false,"mandatory_STOP":true},"admission":"External approval port must atomically bind fresh B3_NEW_ claim and digest of adopted contract; not i